{
  "authority": {
    "may_build_cocos": false,
    "may_enter_credentials": false,
    "may_invoke_devtools": false,
    "may_pay": false,
    "may_preview_device": false,
    "may_publish": false,
    "may_submit_platform": false
  },
  "candidate_only": true,
  "closure_state": "cocos_integration_planned",
  "engine": {
    "creator_cli_state": "unavailable",
    "family": "cocos-creator",
    "source_commit": "68818ea662aba96cf4d2353007e5b5d797a059f8",
    "source_license": "MIT",
    "source_repository": "https://github.com/cocos/cocos-engine",
    "version_line": "3.8"
  },
  "integration_digest": "2e7b301bdd418d13e4426973b3b118b0800aae92f127403cfe6dbd6cc61ef04d",
  "integration_id": "circuit-untangle@0.1.0::data-center-repair-zh-cn::cocos-creator-3.8",
  "materialization_contract": {
    "cocos_project_mutation": false,
    "generated_files": [
      "input/work-package.json",
      "generated/gameplay-kernel.json",
      "generated/content-pack.json",
      "integration-packet.json"
    ],
    "writes_local_candidate_only": true
  },
  "platforms": [
    {
      "build_state": "build_pending",
      "build_target_id": null,
      "engine_source_state": "observed_at_pinned_commit",
      "official_contract_state": "contract_pending",
      "platform_id": "douyin",
      "runtime_api_namespace": "tt"
    },
    {
      "build_state": "build_pending",
      "build_target_id": null,
      "engine_source_state": "observed_at_pinned_commit",
      "official_contract_state": "contract_pending",
      "platform_id": "wechat",
      "runtime_api_namespace": "wx"
    }
  ],
  "required_next_receipts": [
    "creator_installation_readback",
    "exact_creator_version",
    "official_platform_contract",
    "exact_build_target",
    "creator_build_receipt",
    "devtools_import_receipt",
    "real_device_preview_receipt"
  ],
  "schema_version": 1,
  "source_compile_digest": "30ca771eeb8bfcc06af7e94568e75d1bc91a2396a8e841b3a0682155622b70bb"
}
